{"commit_id":"77777777-7777-4777-8777-777777777777","namespace_id":"usr_Example1:char_miku","parent_ids":[],"actor":{"type":"user","id":"22222222-2222-4222-8222-222222222222"},"timestamp":"2026-09-02T00:00:00Z","operations":[{"operation":"create","memory_id":"55555555-5555-4555-8555-555555555555","expected_revision":null,"replacement_memory_id":null}],"reason":"User confirmed preferred language"}
